{
  "agent_id": "/root/host_bridge/v6_2dea6a2a9ca676085285dc07",
  "artifacts": [
    {
      "kind": "ArtIR",
      "sha256": "2cf96f2b38b82bdd331538f2c5ca43fd13296f4991d16f716a8cab3ca81c15be",
      "slot": "art:scene:13x53435f5241494e5f4e49474854:ArtIR",
      "uri": "runtime/v6/candidates/TASK_0560d46ecc764c68ee9a590e/1/art-ir.json"
    }
  ],
  "batch": 1,
  "checks": [
    {
      "evidence": [
        "runtime/v6/candidates/TASK_0560d46ecc764c68ee9a590e/1/evidence/source-integrity.json",
        "runtime/v6/candidates/TASK_0560d46ecc764c68ee9a590e/1/evidence/module-receipt.json"
      ],
      "id": "module_receipt",
      "status": "PASS"
    },
    {
      "evidence": [
        "runtime/v6/candidates/TASK_0560d46ecc764c68ee9a590e/1/evidence/native-validator.json"
      ],
      "id": "native_validator",
      "status": "PASS"
    },
    {
      "evidence": [
        "runtime/v6/candidates/TASK_0560d46ecc764c68ee9a590e/1/evidence/v5-handoff.json",
        "runtime/v6/candidates/TASK_0560d46ecc764c68ee9a590e/1/evidence/v6-handoffs.json",
        "runtime/v6/candidates/TASK_0560d46ecc764c68ee9a590e/1/evidence/native-validator.json"
      ],
      "id": "handoff",
      "status": "PASS"
    }
  ],
  "handoffs": [
    {
      "channel": "artifact",
      "evidence": [
        "runtime/v6/candidates/TASK_0560d46ecc764c68ee9a590e/1/evidence/v6-handoffs.json",
        "runtime/v6/candidates/TASK_0560d46ecc764c68ee9a590e/1/evidence/v5-handoff.json"
      ],
      "requirement_id": "UP_f92e6f7860d8d51c527afd32",
      "source_slot": "canon:project:project:Canon",
      "source_version": 12,
      "target_pointer": "",
      "target_slot": "art:scene:13x53435f5241494e5f4e49474854:ArtIR"
    },
    {
      "channel": "artifact",
      "evidence": [
        "runtime/v6/candidates/TASK_0560d46ecc764c68ee9a590e/1/evidence/v6-handoffs.json",
        "runtime/v6/candidates/TASK_0560d46ecc764c68ee9a590e/1/evidence/v5-handoff.json"
      ],
      "requirement_id": "UP_4ef5cb7085ac9ff34cc5174a",
      "source_slot": "director:project:project:DirectorIR",
      "source_version": 21,
      "target_pointer": "",
      "target_slot": "art:scene:13x53435f5241494e5f4e49474854:ArtIR"
    }
  ],
  "input_digest": "9e3d7e2becb98d9775c71657a1c656d4abf3235710c31223a214ee06a4aa000b",
  "module_receipts": [
    {
      "name": "production-design-grammar",
      "sha256": "34f6b460f4db70acbed406b82edf53b55240fb3f476afd81daeb5c9ac72a8019",
      "version": "1.3.1"
    }
  ],
  "result_sha256": "307a1e78aad5f7e3333581a609e2786b341806086da92761d84e89a815678de9",
  "result_uri": "runtime/v6/candidates/TASK_0560d46ecc764c68ee9a590e/1/role-result.json",
  "schema": "candidate-result/6.0",
  "task_id": "TASK_0560d46ecc764c68ee9a590e",
  "unresolved": []
}
